<ParametricDialog xmlns:xsi="http://www.w3.org/2001/XMLSchema-instance"
    xsi:noNamespaceSchemaLocation="ParametricDialog.xsd">
  <!--Параметрик для выбора типа журнала Взлет-26(М) -->
  <Id>getVzljot26MeasurementDeviceJournal</Id>
  <Height>100</Height>
  <Width>400</Width>
  <Buttons>
    <DialogButton>
      <Title>OK</Title>
      <Order>0</Order>
      <DialogModalResult>Ok</DialogModalResult>
    </DialogButton>
    <DialogButton>
      <Title>Отмена</Title>
      <Order>1</Order>
      <DialogModalResult>Cancel</DialogModalResult>
    </DialogButton>
  </Buttons>
  <AllowResize>false</AllowResize>
  <Title>Параметры</Title>
  <CloseAction>CloseButton</CloseAction>
  <IsSavedState>true</IsSavedState>
  <IsCollectInfoSnapshot>true</IsCollectInfoSnapshot>
  <Descriptors>
    <FormLayoutItemDescriptor>
    <Caption></Caption>
    <Name>channelId</Name>
    <TypeCode>Int32</TypeCode>
    <ParameterValueSourceType>FromInternalCode</ParameterValueSourceType>
    <NestedExtension>Default</NestedExtension>
    <Value>0</Value>
    </FormLayoutItemDescriptor>

    <FormLayoutItemDescriptor>
      <Caption>Канал</Caption>
      <Name>channelId1</Name>
      <TypeCode>Int32</TypeCode>
      <ParameterValueSourceType>FromUser</ParameterValueSourceType>
      <NestedExtension>ComboBox</NestedExtension>

      <FormLayoutItemListBoxSetting>
        <DataSourceType>DictionaryByQuery</DataSourceType>
        <DataSource>DictionaryEntity</DataSource>
        <DataSourceQuery>
          SELECT
          [Ch].[Id] [Id],
          [Ch].[Description] [Code],
          [R].[Description] [Description]
          FROM [Business].[Channel] [Ch] WITH(NOLOCK)
          INNER JOIN [Dictionaries].[ResourceSystemType] [R] WITH(NOLOCK)
          ON [Ch].[ResourceSystemTypeId] = [R].[Id]
          WHERE [Ch].[Id] = @channelId
        </DataSourceQuery>
        <FormLayoutItemListBoxColumns>
          <FormLayoutItemListBoxColumn>
            <FieldName>Id</FieldName>
            <Caption></Caption>
            <Width>20</Width>
          </FormLayoutItemListBoxColumn>
          <FormLayoutItemListBoxColumn>
            <FieldName>Code</FieldName>
            <Caption></Caption>
            <Width>100</Width>
          </FormLayoutItemListBoxColumn>
          <FormLayoutItemListBoxColumn>
            <FieldName>Description</FieldName>
            <Caption></Caption>
            <Width>200</Width>
          </FormLayoutItemListBoxColumn>
        </FormLayoutItemListBoxColumns>

      </FormLayoutItemListBoxSetting>

      <Value>0</Value>

      <FormLayoutItemExtenders>
        <FormLayoutItemExtender>
          <PropertiesChain>NestedExtensionSettings.ReadOnly</PropertiesChain>
          <Value>false</Value>
        </FormLayoutItemExtender>

        <FormLayoutItemExtender>
          <PropertiesChain>NestedExtensionSettings.Properties.ValueField</PropertiesChain>
          <Value>Id</Value>
        </FormLayoutItemExtender>
        <FormLayoutItemExtender>
          <PropertiesChain>NestedExtensionSettings.Properties.TextField</PropertiesChain>
          <Value>Description</Value>
        </FormLayoutItemExtender>
        <FormLayoutItemExtender>
          <PropertiesChain>NestedExtensionSettings.Properties.TextFormatString</PropertiesChain>
          <Value>{1}</Value>
        </FormLayoutItemExtender>
      </FormLayoutItemExtenders>

    </FormLayoutItemDescriptor>
    <FormLayoutItemDescriptor>
      <Caption>Тип архива</Caption>
      <Name>asyncArchiveTypeId</Name>
      <TypeCode>Int32</TypeCode>
      <ParameterValueSourceType>FromUser</ParameterValueSourceType>
      <NestedExtension>ComboBox</NestedExtension>
      <FormLayoutItemListBoxSetting>
        <DataSourceType>DictionaryList</DataSourceType>
        <DataSource>
          [{Id:0, Code: "DatabaseChanges", Description: "Журнал нештатных ситуаций"},
          {Id:1, Code: "Events", Description: "Журнал отказов"},
          {Id:2, Code: "Diagnostic", Description: "Журнал режимов (электронная пломба)"}]
        </DataSource>
        <FormLayoutItemListBoxColumns>
          <FormLayoutItemListBoxColumn>
            <FieldName>Id</FieldName>
            <Caption>Ид</Caption>
            <Width>20</Width>
          </FormLayoutItemListBoxColumn>
          <FormLayoutItemListBoxColumn>
            <FieldName>Description</FieldName>
            <Caption>Наименование</Caption>
            <Width>250</Width>
          </FormLayoutItemListBoxColumn>
        </FormLayoutItemListBoxColumns>
      </FormLayoutItemListBoxSetting>
      <FormLayoutItemExtenders>
        <FormLayoutItemExtender>
          <PropertiesChain>NestedExtensionSettings.Properties.ValueField</PropertiesChain>
          <Value>Id</Value>
        </FormLayoutItemExtender>
        <FormLayoutItemExtender>
          <PropertiesChain>NestedExtensionSettings.Properties.TextField</PropertiesChain>
          <Value>Description</Value>
        </FormLayoutItemExtender>
        <FormLayoutItemExtender>
          <PropertiesChain>NestedExtensionSettings.Properties.TextFormatString</PropertiesChain>
          <Value>{1}</Value>
        </FormLayoutItemExtender>
      </FormLayoutItemExtenders>
    </FormLayoutItemDescriptor>
  </Descriptors>
</ParametricDialog>