<ParametricDialog xmlns:xsi="http://www.w3.org/2001/XMLSchema-instance"
    xsi:noNamespaceSchemaLocation="ParametricDialog.xsd">
  <!--Парамерик для выбора типа измерительного прибора для запроса по списку соотвествия пареметров -->
  <Id>getParametersInfoByDeviceParametricDialog</Id>
  <Height>100</Height>
  <Width>400</Width>
  <Buttons>
    <DialogButton>
      <Title>OK</Title>
      <Order>0</Order>
      <DialogModalResult>Ok</DialogModalResult>
    </DialogButton>
    <DialogButton>
      <Title>Отмена</Title>
      <Order>1</Order>
      <DialogModalResult>Cancel</DialogModalResult>
    </DialogButton>
  </Buttons>
  <Title>Параметры</Title>
  <IsSavedState>true</IsSavedState>
  <IsCollectInfoSnapshot>true</IsCollectInfoSnapshot>
  <Descriptors>
    <FormLayoutItemDescriptor>
      <Caption>Тип измерительного прибора</Caption>
      <Name>deviceId</Name>
      <TypeCode>String</TypeCode>
      <ParameterValueSourceType>FromUser</ParameterValueSourceType>
      <NestedExtension>ComboBox</NestedExtension>      
      <FormLayoutItemListBoxSetting>        
        <DataSourceType>DictionaryWithAll</DataSourceType>
        <DataSource>Device</DataSource>        
        <FormLayoutItemListBoxColumns>
          <FormLayoutItemListBoxColumn>
            <FieldName>Id</FieldName>
            <Caption></Caption>
            <Width>20</Width>
          </FormLayoutItemListBoxColumn>
          <FormLayoutItemListBoxColumn>
            <FieldName>Code</FieldName>
            <Caption></Caption>
            <Width>100</Width>
          </FormLayoutItemListBoxColumn>
          <FormLayoutItemListBoxColumn>
            <FieldName>Description</FieldName>
            <Caption></Caption>
            <Width>200</Width>
          </FormLayoutItemListBoxColumn>
        </FormLayoutItemListBoxColumns>
      </FormLayoutItemListBoxSetting>
      <FormLayoutItemExtenders>
        <FormLayoutItemExtender>
          <PropertiesChain>NestedExtensionSettings.Properties.ValueField</PropertiesChain>
          <Value>Id</Value>
        </FormLayoutItemExtender>
        <FormLayoutItemExtender>
          <PropertiesChain>NestedExtensionSettings.Properties.TextField</PropertiesChain>
          <Value>Description</Value>
        </FormLayoutItemExtender>
        <FormLayoutItemExtender>
          <PropertiesChain>NestedExtensionSettings.Properties.TextFormatString</PropertiesChain>
          <Value>{2}</Value>
        </FormLayoutItemExtender>                
      </FormLayoutItemExtenders>
    </FormLayoutItemDescriptor>    
  </Descriptors>
</ParametricDialog>
