<ParametricDialog xmlns:xsi="http://www.w3.org/2001/XMLSchema-instance"
                  xsi:noNamespaceSchemaLocation="ParametricDialog.xsd">
  <Id>FlatDevicesConnectionQualityParametricDialog</Id>
  <Height>0</Height>
  <Width>350</Width>
  <Buttons>
    <DialogButton>
      <Title>OK</Title>
      <Order>0</Order>
      <DialogModalResult>Ok</DialogModalResult>
    </DialogButton>
    <DialogButton>
      <Title>Отмена</Title>
      <Order>1</Order>
      <DialogModalResult>Cancel</DialogModalResult>
    </DialogButton>
  </Buttons>
  <Title>Параметры</Title>
  <IsSavedState>false</IsSavedState>

  <Descriptors>
    <FormLayoutItemDescriptor>
      <Caption>Строение</Caption>
      <Name>BuildingId</Name>
      <TypeCode>Int32</TypeCode>
      <ParameterValueSourceType>FromUser</ParameterValueSourceType>
      <NestedExtension>ComboBox</NestedExtension>
      <FormLayoutItemListBoxSetting>
        <DataSourceType>DictionaryByQuery</DataSourceType>
        <DataSource>DictionaryEntity</DataSource>
        <DataSourceQuery>
          SELECT DISTINCT([B].[Id]) [Id],
          [B].[Description] [Description]
          FROM [Business].[Building] [B] WITH(NOLOCK)
          INNER JOIN [Business].[AccessPointLinkBuilding] [Aplb] WITH(NOLOCK) ON [Aplb].[BuildingId] = [B].[Id]
          INNER JOIN [Business].[AccessPoint] [Ap] WITH(NOLOCK) ON [Aplb].[AccessPointId] = [Ap].[Id]
          INNER JOIN [Business].[MeasurementDevice] [Md] WITH(NOLOCK) ON [Ap].[Id] = [Md].[AccessPointId]
          INNER JOIN [Business].[Channel] [Channel] WITH(NOLOCK) ON [Md].[Id] = [Channel].[MeasurementDeviceId]
          INNER JOIN [Business].[Placement] [P] WITH(NOLOCK) ON [P].[BuildingId] = [B].[Id] AND [P].[PlacementPurposeId] = 1
          WHERE [Channel].[Id]  IN
          (
          SELECT [Ul].[ChannelId]
          FROM [Business].[UserLinkChannel] [Ul] WITH(NOLOCK)
          WHERE [Ul].[UserId] = (SELECT TOP(1) [User].[Id] FROM [Admin].[User] [User] WITH(NOLOCK) WHERE [User].[UserName] = @userName)
          ) OR &apos;ADMIN&apos; = @roleName

          UNION
          SELECT 0 [Id], &apos;Все строения&apos; [Description]
          ORDER BY [Id]
        </DataSourceQuery>
        <FormLayoutItemListBoxColumns>
          <FormLayoutItemListBoxColumn>
            <FieldName>Id</FieldName>
            <Caption>Ид</Caption>
            <Width>20</Width>
          </FormLayoutItemListBoxColumn>
          <FormLayoutItemListBoxColumn>
            <FieldName>Description</FieldName>
            <Caption>Наименование</Caption>
            <Width>300</Width>
          </FormLayoutItemListBoxColumn>
        </FormLayoutItemListBoxColumns>
      </FormLayoutItemListBoxSetting>
      <FormLayoutItemExtenders>
        <FormLayoutItemExtender>
          <PropertiesChain>NestedExtensionSettings.Properties.ValueField</PropertiesChain>
          <Value>Id</Value>
        </FormLayoutItemExtender>
        <FormLayoutItemExtender>
          <PropertiesChain>NestedExtensionSettings.Properties.TextField</PropertiesChain>
          <Value>Description</Value>
        </FormLayoutItemExtender>
        <FormLayoutItemExtender>
          <PropertiesChain>NestedExtensionSettings.Properties.TextFormatString</PropertiesChain>
          <Value>{1}</Value>
        </FormLayoutItemExtender>
      </FormLayoutItemExtenders>
    </FormLayoutItemDescriptor>

    <FormLayoutItemDescriptor>
      <Caption>Тип ресурсной системы</Caption>
      <Name>ResourceSystemTypeId</Name>
      <TypeCode>String</TypeCode>
      <ParameterValueSourceType>FromUser</ParameterValueSourceType>
      <NestedExtension>ComboBox</NestedExtension>
      <FormLayoutItemListBoxSetting>
        <DataSourceType>DictionaryWithAll</DataSourceType>
        <DataSource>ResourceSystemType</DataSource>
        <FormLayoutItemListBoxColumns>
          <FormLayoutItemListBoxColumn>
            <FieldName>Id</FieldName>
            <Caption></Caption>
            <Width>20</Width>
          </FormLayoutItemListBoxColumn>
          <FormLayoutItemListBoxColumn>
            <FieldName>Description</FieldName>
            <Caption></Caption>
            <Width>300</Width>
          </FormLayoutItemListBoxColumn>
        </FormLayoutItemListBoxColumns>
      </FormLayoutItemListBoxSetting>
      <Value>0</Value>
      <FormLayoutItemExtenders>
        <FormLayoutItemExtender>
          <PropertiesChain>NestedExtensionSettings.Properties.ValueField</PropertiesChain>
          <Value>Id</Value>
        </FormLayoutItemExtender>
        <FormLayoutItemExtender>
          <PropertiesChain>NestedExtensionSettings.Properties.TextField</PropertiesChain>
          <Value>Description</Value>
        </FormLayoutItemExtender>
        <FormLayoutItemExtender>
          <PropertiesChain>NestedExtensionSettings.Properties.TextFormatString</PropertiesChain>
          <Value>{1}</Value>
        </FormLayoutItemExtender>
      </FormLayoutItemExtenders>
    </FormLayoutItemDescriptor>

    <FormLayoutItemDescriptor>
      <Caption>Статус подключения прибора</Caption>
      <Name>DeviceStatusId</Name>
      <TypeCode>String</TypeCode>
      <ParameterValueSourceType>FromUser</ParameterValueSourceType>
      <NestedExtension>ComboBox</NestedExtension>
      <FormLayoutItemListBoxSetting>
        <DataSourceType>DictionaryWithAll</DataSourceType>
        <DataSource>StatusConnection</DataSource>
        <FormLayoutItemListBoxColumns>
          <FormLayoutItemListBoxColumn>
            <FieldName>Id</FieldName>
            <Caption></Caption>
            <Width>20</Width>
          </FormLayoutItemListBoxColumn>
          <FormLayoutItemListBoxColumn>
            <FieldName>Description</FieldName>
            <Caption></Caption>
            <Width>300</Width>
          </FormLayoutItemListBoxColumn>
        </FormLayoutItemListBoxColumns>
      </FormLayoutItemListBoxSetting>
      <Value>0</Value>
      <FormLayoutItemExtenders>
        <FormLayoutItemExtender>
          <PropertiesChain>NestedExtensionSettings.Properties.ValueField</PropertiesChain>
          <Value>Id</Value>
        </FormLayoutItemExtender>
        <FormLayoutItemExtender>
          <PropertiesChain>NestedExtensionSettings.Properties.TextField</PropertiesChain>
          <Value>Description</Value>
        </FormLayoutItemExtender>
        <FormLayoutItemExtender>
          <PropertiesChain>NestedExtensionSettings.Properties.TextFormatString</PropertiesChain>
          <Value>{1}</Value>
        </FormLayoutItemExtender>
      </FormLayoutItemExtenders>
    </FormLayoutItemDescriptor>
  </Descriptors>
</ParametricDialog>  
