<ParametricDialog xmlns:xsi="http://www.w3.org/2001/XMLSchema-instance" xsi:noNamespaceSchemaLocation="ParametricDialog.xsd">
  <Id>pivotGridParametric</Id>
  <Height>0</Height>
  <Width>400</Width>
  <Buttons>
    <DialogButton>
      <Title>OK</Title>
      <Order>0</Order>
      <DialogModalResult>Ok</DialogModalResult>
    </DialogButton>
    <DialogButton>
      <Title>Отмена</Title>
      <Order>1</Order>
      <DialogModalResult>Cancel</DialogModalResult>
    </DialogButton>
  </Buttons>
  <Title>Параметры</Title>
  <Descriptors>
    <FormLayoutItemDescriptor>
      <Caption>Количество активных тарифов</Caption>
      <Name>ActiveTariffCount</Name>
      <TypeCode>Decimal</TypeCode>
      <ParameterValueSourceType>FromUser</ParameterValueSourceType>
      <NestedExtension>SpinEdit</NestedExtension>
      <Value>2</Value>
    </FormLayoutItemDescriptor>
    <FormLayoutItemDescriptor>
      <Caption>ID (общий тариф)</Caption>
      <Name>CommonTariffId</Name>
      <TypeCode>Decimal</TypeCode>
      <ParameterValueSourceType>FromUser</ParameterValueSourceType>
      <NestedExtension>SpinEdit</NestedExtension>
      <Value>0</Value>
    </FormLayoutItemDescriptor>
    <FormLayoutItemDescriptor>
      <Caption>ID (тариф 1)</Caption>
      <Name>Tariff1Id</Name>
      <TypeCode>Decimal</TypeCode>
      <ParameterValueSourceType>FromUser</ParameterValueSourceType>
      <NestedExtension>SpinEdit</NestedExtension>
      <Value>0</Value>
    </FormLayoutItemDescriptor>
    <FormLayoutItemDescriptor>
      <Caption>ID (тариф 2)</Caption>
      <Name>Tariff2Id</Name>
      <TypeCode>Decimal</TypeCode>
      <ParameterValueSourceType>FromUser</ParameterValueSourceType>
      <NestedExtension>SpinEdit</NestedExtension>
      <Value>0</Value>
    </FormLayoutItemDescriptor>
    <FormLayoutItemDescriptor>
      <Caption>ID (тариф 3)</Caption>
      <Name>Tariff3Id</Name>
      <TypeCode>Decimal</TypeCode>
      <ParameterValueSourceType>FromUser</ParameterValueSourceType>
      <NestedExtension>SpinEdit</NestedExtension>
      <Value>0</Value>
    </FormLayoutItemDescriptor>
    <FormLayoutItemDescriptor>
      <Caption>ID (тариф 4)</Caption>
      <Name>Tariff4Id</Name>
      <TypeCode>Decimal</TypeCode>
      <ParameterValueSourceType>FromUser</ParameterValueSourceType>
      <NestedExtension>SpinEdit</NestedExtension>
      <Value>0</Value>
    </FormLayoutItemDescriptor>
    <FormLayoutItemDescriptor>
      <Caption>Вес импульса</Caption>
      <Name>PulseWeight</Name>
      <TypeCode>Decimal</TypeCode>
      <ParameterValueSourceType>FromUser</ParameterValueSourceType>
      <NestedExtension>SpinEdit</NestedExtension>
      <Value>0.0002</Value>
    </FormLayoutItemDescriptor>
    <FormLayoutItemDescriptor>
      <Caption>Единица измерения веса импульса</Caption>
      <Name>MeasurementUnitId</Name>
      <TypeCode>Int32</TypeCode>
      <ParameterValueSourceType>FromUser</ParameterValueSourceType>
      <NestedExtension>ComboBox</NestedExtension>
      <FormLayoutItemListBoxSetting>
        <DataSourceType>Dictionary</DataSourceType>
        <DataSource>MeasurementUnit</DataSource>
        <FormLayoutItemListBoxColumns>
          <FormLayoutItemListBoxColumn>
            <FieldName>Id</FieldName>
            <Caption></Caption>
            <Width>20</Width>
          </FormLayoutItemListBoxColumn>
          <FormLayoutItemListBoxColumn>
            <FieldName>Code</FieldName>
            <Caption></Caption>
            <Width>100</Width>
          </FormLayoutItemListBoxColumn>
          <FormLayoutItemListBoxColumn>
            <FieldName>Description</FieldName>
            <Caption></Caption>
            <Width>200</Width>
          </FormLayoutItemListBoxColumn>
        </FormLayoutItemListBoxColumns>
      </FormLayoutItemListBoxSetting>
      <Value>20</Value>
      <FormLayoutItemExtenders>
        <FormLayoutItemExtender>
          <PropertiesChain>NestedExtensionSettings.Properties.ValueField</PropertiesChain>
          <Value>Id</Value>
        </FormLayoutItemExtender>
        <FormLayoutItemExtender>
          <PropertiesChain>NestedExtensionSettings.Properties.TextField</PropertiesChain>
          <Value>Description</Value>
        </FormLayoutItemExtender>
        <FormLayoutItemExtender>
          <PropertiesChain>NestedExtensionSettings.Properties.TextFormatString</PropertiesChain>
          <Value>{2}</Value>
        </FormLayoutItemExtender>
      </FormLayoutItemExtenders>
    </FormLayoutItemDescriptor>
    <FormLayoutItemDescriptor>
      <Caption>Размерность веса импульса</Caption>
      <Name>DimensionId</Name>
      <TypeCode>Int32</TypeCode>
      <ParameterValueSourceType>FromUser</ParameterValueSourceType>
      <NestedExtension>ComboBox</NestedExtension>
      <FormLayoutItemListBoxSetting>
        <DataSourceType>Dictionary</DataSourceType>
        <DataSource>Dimension</DataSource>
        <FormLayoutItemListBoxColumns>
          <FormLayoutItemListBoxColumn>
            <FieldName>Id</FieldName>
            <Caption></Caption>
            <Width>20</Width>
          </FormLayoutItemListBoxColumn>
          <FormLayoutItemListBoxColumn>
            <FieldName>Code</FieldName>
            <Caption></Caption>
            <Width>100</Width>
          </FormLayoutItemListBoxColumn>
          <FormLayoutItemListBoxColumn>
            <FieldName>Description</FieldName>
            <Caption></Caption>
            <Width>200</Width>
          </FormLayoutItemListBoxColumn>
        </FormLayoutItemListBoxColumns>
      </FormLayoutItemListBoxSetting>
      <Value>3</Value>
      <FormLayoutItemExtenders>
        <FormLayoutItemExtender>
          <PropertiesChain>NestedExtensionSettings.Properties.ValueField</PropertiesChain>
          <Value>Id</Value>
        </FormLayoutItemExtender>
        <FormLayoutItemExtender>
          <PropertiesChain>NestedExtensionSettings.Properties.TextField</PropertiesChain>
          <Value>Description</Value>
        </FormLayoutItemExtender>
        <FormLayoutItemExtender>
          <PropertiesChain>NestedExtensionSettings.Properties.TextFormatString</PropertiesChain>
          <Value>{2}</Value>
        </FormLayoutItemExtender>
      </FormLayoutItemExtenders>
    </FormLayoutItemDescriptor>
  </Descriptors>
</ParametricDialog>
